<?xml version="1.0" encoding="UTF-8"?>



<!ELEMENT empleados (empleado+,cargos)+>
<!ELEMENT empleado (#PCDATA)>
    <!ATTLIST empleado codEmpl ID #REQUIRED>
    
<!ELEMENT cargos (cargo+)>
<!ELEMENT cargo (#PCDATA)>
   <!ATTLIST cargo ejecutivo IDREFS #REQUIRED>
